id_produccion,obra,productora,anio_inicio,anio_fin,teatro,gira,activa,id_obra,id_teatro
"101 DÁLMATAS, EL MUSICAL_TEATROPOLIS (GRAN TEATRO CAIXABANK PRÍNCIPE PÍO)_2023_GRAN TEATRO CAIXABANK PRÍNCIPE PÍO","101 Dálmatas, el musical",Teatropolis (Gran Teatro CaixaBank Príncipe Pío),2023,,Gran Teatro CaixaBank Príncipe Pío,False,True,1,1
ALADDÍN_STAGE ENTERTAINMENT_2023_TEATRO COLISEUM,Aladdín,Stage Entertainment,2023,2025,Teatro Coliseum,False,False,2,2
ANASTASIA_STAGE ENTERTAINMENT_2018_TEATRO COLISEUM,Anastasia,Stage Entertainment,2018,2020,Teatro Coliseum,False,False,3,2
ANNIE_THEATRE PROPERTIES_2010_TEATRO NUEVO ALCALÁ,Annie,Theatre Properties,2010,2011,Teatro Nuevo Alcalá,False,False,4,3
AVENUE Q_SMEDIA_2010_TEATRO NUEVO APOLO,Avenue Q,SMedia,2010,2011,Teatro Nuevo Apolo,False,False,5,4
AVENUE Q_TEATROPOLIS (GRAN TEATRO CAIXABANK PRÍNCIPE PÍO)_2024_GRAN TEATRO CAIXABANK PRÍNCIPE PÍO,Avenue Q,Teatropolis (Gran Teatro CaixaBank Príncipe Pío),2024,,Gran Teatro CaixaBank Príncipe Pío,False,True,5,1
BILLY ELLIOT_ATG ENTERTAINMENT_2017_TEATRO NUEVO ALCALÁ,Billy Elliot,ATG Entertainment,2017,2020,Teatro Nuevo Alcalá,True,False,6,3
CABARET_LET'S GO COMPANY_2025_TEATRO ALBÉNIZ,Cabaret,Let's Go Company,2025,,Teatro Albéniz,False,True,7,5
CANTANDO BAJO LA LLUVIA_NOSTROMO LIVE_2021_TEATRO TÍVOLI,Cantando bajo la lluvia,Nostromo live,2021,2023,Teatro Tívoli,True,False,8,6
CENICIENTA_STAGE ENTERTAINMENT_2025_TEATRO COLISEUM,Cenicienta,Stage Entertainment,2025,,Teatro Coliseum,False,True,9,2
CHARLIE Y LA FÁBRICA DE CHOCOLATE_LET'S GO COMPANY_2021_ESPACIO IBERCAJA DELICIAS,Charlie y la fábrica de chocolate,Let's Go Company,2021,2022,Espacio Ibercaja Delicias,True,False,10,7
CHICAGO_ATG ENTERTAINMENT_2023_TEATRO NUEVO APOLO,Chicago,ATG Entertainment,2023,2025,Teatro Nuevo Apolo,True,False,11,4
COME FROM AWAY_THE STAGE COMPANY_2024_TEATRO MARQUINA,Come from away,The Stage Company,2024,2025,Teatro Marquina,False,False,12,8
COMPANY_TEATRO DEL SOHO S.L._2021_TEATRO DEL SOHO,Company,Teatro del Soho S.L.,2021,2023,Teatro Del Soho,False,False,13,9
DIRTY DANCING_LET'S GO COMPANY_2018_TEATRO NUEVO ALCALÁ,Dirty Dancing,Let's Go Company,2018,2023,Teatro Nuevo Alcalá,True,False,14,3
EL DÍA DE LA MARMOTA_NOSTROMO LIVE_2024_TEATRE APOLO,El Día de la Marmota,Nostromo Live,2024,2025,Teatre Apolo,False,False,15,10
EL FANTASMA DE LA ÓPERA_LET'S GO COMPANY_2023_TEATRO ALBÉNIZ,El Fantasma de la Ópera,Let's Go Company,2023,,Teatro Albéniz,True,True,16,5
EL GUARDAESPALDAS_STAGE ENTERTAINMENT_2017_TEATRO COLISEUM,El Guardaespaldas,Stage Entertainment,2017,2018,Teatro Coliseum,True,False,17,2
EL JOVENCITO FRANKENSTEIN_LET'S GO COMPANY_2018_TEATRO EDP GRAN VÍA,El Jovencito Frankenstein,Let's Go Company,2018,2019,Teatro EDP Gran Vía,False,False,18,11
EL MÉDICO_BEON ENTERTAINMENT_2018_TEATRO NUEVO APOLO,El Médico,Beon Entertainment,2018,2023,Teatro Nuevo Apolo,True,False,19,4
EL REY LEÓN_STAGE ENTERTAINMENT_2011_TEATRO LOPE DE VEGA,El Rey León,Stage Entertainment,2011,,Teatro Lope de Vega,False,True,20,12
EL TIEMPO ENTRE COSTURAS_BEON ENTERTAINMENT_2021_TEATRO PRINCIPAL DE ZARAGOZA,El Tiempo entre Costuras,Beon Entertainment,2021,2024,Teatro Principal de Zaragoza,True,False,21,13
EL ASCENSOR_ACTOR’S FIRST._2017_TEATRO PAVÓN,El ascensor,Actor’s First.,2017,2018,Teatro Pavón,True,False,22,14
EL ÚLTIMO JINETE_ARABIAN HORSES PRODUCTION LTD_2012_TEATROS DEL CANAL,El último jinete,Arabian Horses Production LTD,2012,2013,Teatros del Canal,False,False,23,15
EN TIERRA EXTRAÑA_ATG ENTERTAINMENT_2021_TEATRO ESPAÑOL,En tierra extraña,ATG Entertainment,2021,2023,Teatro Español,True,False,24,16
FLASHDANCE_SELLADOOR WORLDWIDE_2019_TEATRO TÍVOLI,Flashdance,Selladoor Worldwide,2019,2020,Teatro Tívoli,True,False,25,6
FOLLIES_MARIO GAS_2012_TEATRO ESPAÑOL,Follies,Mario Gas,2012,2013,Teatro Español,False,False,26,16
FOREVER YOUNG_TRICICLE_2011_TEATRO EDP GRAN VÍA,Forever Young,Tricicle,2011,2022,Teatro EDP Gran Vía,True,False,27,11
"GHOST, EL MUSICAL_LET'S GO COMPANY_2019_TEATRO EDP GRAN VÍA","Ghost, el musical",Let's Go Company,2019,2024,Teatro EDP Gran Vía,True,False,28,11
GOLFUS DE ROMA_EUROSCENA_2015_VERANOS DE LA VILLA,Golfus de Roma,Euroscena,2015,2015,Veranos de la Villa,False,False,29,17
GOLFUS DE ROMA_PENTACIÓN ESPECTÁCULOS_2022_TEATRO LA LATINA,Golfus de Roma,Pentación Espectáculos,2022,2023,Teatro La Latina,True,False,29,18
GREASE_DRIVE ENTERTAINMENT_2011_LAS ARENAS,Grease,Drive Entertainment,2011,2014,Las Arenas,True,False,30,19
GREASE_ATG ENTERTAINMENT_2021_TEATRO NUEVO ALCALÁ,Grease,ATG Entertainment,2021,2023,Teatro Nuevo Alcalá,True,False,30,3
GYPSY_TEATRO DEL SOHO S.L._2024_TEATRO DEL SOHO,Gypsy,Teatro del Soho S.L.,2024,2025,Teatro Del Soho,False,False,31,9
HAIR_THE WILLIAM MORRIS AGENCY ENDEAVOR ENTERTAINMENT; ILLUMINATI PRODUCTION GROUP; PUBLINTERMEDIA CONSULTING; JK PRODUCTIONS_2010_TEATRE APOLO,Hair,The William Morris Agency Endeavor Entertainment; Illuminati Production Group; Publintermedia Consulting; JK Productions,2010,2011,Teatre Apolo,False,False,32,10
HOUDINI_LET'S GO COMPANY_2025_TEATRO CALDERÓN,Houdini,Let's Go Company,2025,,Teatro Calderón,False,True,33,20
KINKY BOOTS_LET'S GO COMPANY_2021_ESPACIO DELICIAS,Kinky Boots,Let's Go Company,2021,2022,Espacio Delicias,False,False,34,21
KINKY BOOTS_THEATRE PROPERTIES_2024_TEATRO RIALTO,Kinky Boots,Theatre Properties,2024,2025,Teatro Rialto,True,False,34,22
LA ALEGRÍA QUE PASA_DAGOLL DAGOM_2022_TEATRE POLIORAMA,La Alegría que Pasa,Dagoll Dagom,2022,2023,Teatre Poliorama,True,False,35,23
LA FAMILIA ADDAMS_LET'S GO COMPANY_2017_TEATRO CALDERÓN,La Familia Addams,Let's Go Company,2017,2018,Teatro Calderón,True,False,36,20
LA HISTORIA INTERMINABLE_BEON ENTERTAINMENT_2022_TEATRO CALDERÓN,La Historia Interminable,Beon Entertainment,2022,2024,Teatro Calderón,True,False,37,20
LA JAULA DE LAS LOCAS_NOSTROMO LIVE_2018_TEATRO TÍVOLI,La Jaula de las Locas,Nostromo Live,2018,2020,Teatro Tívoli,True,False,38,6
LA LLAMADA_SUMA LATINA / LOS JAVIS_2013_TEATRO LARA,La Llamada,Suma Latina / Los Javis,2013,,Teatro Lara,True,True,39,24
LA BELLA Y LA BESTIA_STAGE ENTERTAINMENT_2012_TEATRO CALDERÓN,La bella y la bestia,Stage Entertainment,2012,2013,Teatro Calderón,True,False,40,20
"LA MOVIDA,EL MUSICAL_THEATRE PROPERTIES_2024_TEATRO COLISEUM","La movida,el musical",Theatre Properties,2024,2025,Teatro Coliseum,True,False,41,2
LOS MISERABLES_ATG ENTERTAINMENT_2025_TEATRO NUEVO APOLO,Los Miserables,ATG Entertainment,2025,,Teatro Nuevo Apolo,False,True,42,4
LOS PILARES DE LA TIERRA_BEON ENTERTAINMENT_2024_TEATRO EDP GRAN VÍA,Los Pilares de la Tierra,Beon Entertainment,2024,,Teatro EDP Gran Vía,True,True,43,11
LOS PRODUCTORES_NOSTROMO LIVE_2023_TEATRO TÍVOLI,Los Productores,Nostromo Live,2023,2024,Teatro Tívoli,True,False,44,6
LOS PUENTES DE MADISON_SMEDIA_2022_TEATRO EDP GRAN VÍA,Los puentes de Madison,SMedia,2022,2023,Teatro EDP Gran Vía,False,False,45,11
MALINCHE_HATCHWELL INVERSIONES MUSICALES S.L._2022_IFEMA MADRID LIVE,Malinche,Hatchwell Inversiones Musicales S.L.,2022,2025,Ifema Madrid Live,True,False,46,25
MAMMA MIA!_ATG ENTERTAINMENT_2022_TEATRO RIALTO,Mamma Mia!,ATG Entertainment,2022,,Teatro Rialto,True,True,47,22
MARI I CEL_DAGOLL DAGOM_2024_TEATRE VICTÒRIA,Mari i Cel,Dagoll Dagom,2024,2025,Teatre Victòria,True,False,48,26
MARTA TIENE UN MARCAPASOS_SMEDIA_2013_TEATRO EDP GRAN VÍA,Marta tiene un marcapasos,Smedia,2013,2014,Teatro EDP Gran Vía,True,False,49,11
MAS DE 100 MENTIRAS_DRIVE ENTERTAINMENT_2011_TEATRO RIALTO,Mas de 100 mentiras,Drive Entertainment,2011,2013,Teatro Rialto,True,False,50,22
MATILDA_ATG ENTERTAINMENT_2022_TEATRO NUEVO ALCALÁ,Matilda,ATG Entertainment,2022,2024,Teatro Nuevo Alcalá,False,False,51,3
MY FAIR LADY_STAGE ENTERTAINMENT_2012_AUDITORIO DE TENERIFE,My fair lady,Stage Entertainment,2012,2012,Auditorio de Tenerife,True,False,52,27
PEGADOS_FERRAN GONZÁLEZ & ALÍCIA SERRAT_2010_ALMERÍA TEATRE,Pegados,Ferran González & Alícia Serrat,2010,2013,Almería Teatre,True,False,53,28
"PRISCILLA, REINA DEL DESIERTO_ATG ENTERTAINMENT_2014_TEATRO NUEVO ALCALÁ","Priscilla, reina del desierto",ATG Entertainment,2014,2015,Teatro Nuevo Alcalá,True,False,54,3
QUIEN MATÓ A SHERLOCK HOLMES?_BEON ENTERTAINMENT_2020_TEATRO EDP GRAN VÍA,Quien mató a Sherlock Holmes?,Beon Entertainment,2020,2021,Teatro EDP Gran Vía,False,False,55,11
"ROMEO Y JULIETA, EL MUSICAL_THEATRE PROPERTIES_2021_TEATRO LA LATINA","Romeo y Julieta, el musical",Theatre Properties,2021,2024,Teatro La Latina,True,False,56,18
SCHOOL OF ROCK_LET'S GO COMPANY_2024_ESPACIO DELICIAS,School of Rock,Let's Go Company,2024,2024,Espacio Delicias,False,False,57,21
SISTER ACT_STAGE ENTERTAINMENT_2014_TEATRO TÍVOLI,Sister Act,Stage Entertainment,2014,2016,Teatro Tívoli,True,False,58,6
SISTER ACT_STAGE ENTERTAINMENT_2015_TEATRO NUEVO ALCALÁ,Sister Act,Stage Entertainment,2015,2015,Teatro Nuevo Alcalá,True,False,58,3
SONRISAS Y LÁGRIMAS_ATG ENTERTAINMENT_2011_TEATRO COLISEUM,Sonrisas y lágrimas,ATG Entertainment,2011,2013,Teatro Coliseum,True,False,59,2
THE BOOK OF MORMON_ATG ENTERTAINMENT_2023_TEATRO CALDERÓN,The Book of Mormon,ATG Entertainment,2023,,Teatro Calderón,False,True,60,20
THE HOLE_LET'S GO COMPANY_2011_TEATRO CALDERÓN,The Hole,Let's Go Company,2011,2023,Teatro Calderón,True,False,61,20
THE FULL MONTY_THEATRE PROPERTIES_2021_TEATRO RIALTO,The full monty,Theatre Properties,2021,2023,Teatro Rialto,True,False,62,22
TINA_STAGE ENTERTAINMENT_2021_TEATRO COLISEUM,Tina,Stage Entertainment,2021,2023,Teatro Coliseum,False,False,63,2
TOCANDO NUESTRA CANCIÓN_TEATRO DEL SOHO S.L._2024_TEATRO DEL SOHO,Tocando nuestra canción,Teatro del Soho S.L.,2024,2024,Teatro Del Soho,False,False,64,9
UNA RUBIA MUY LEGAL_PENTACIÓN ESPECTÁCULOS_2023_TEATRO LA LATINA,Una rubia muy legal,Pentación Espectáculos,2023,2024,Teatro La Latina,False,False,65,18
WE WILL ROCK YOU_TEATROPOLIS (GRAN TEATRO CAIXABANK PRÍNCIPE PÍO)_2023_GRAN TEATRO CAIXABANK PRÍNCIPE PÍO,We Will Rock You,Teatropolis (Gran Teatro CaixaBank Príncipe Pío),2023,,Gran Teatro CaixaBank Príncipe Pío,False,True,66,1
